ID,N_VICTIMAS,FECHA,AAAA,MM,DD,HORA,HH,LUGAR_DEL_HECHO,TIPO_DE_CALLE,Calle,Altura,Cruce,Dirección Normalizada,COMUNA,pos x,pos y,PARTICIPANTES,VICTIMA,ACUSADO
2018-0023,1,2018-02-24,2018,2,24,2023-12-01 06:00:00,1970-01-01 00:00:00.000000006,Barco Centenera Del y Rosario,CALLE,BARCO CENTENERA DEL,"5402, Avenida Rivadavia, Caballito, Buenos Aires, Comuna 6, Ciudad Autónoma de Buenos Aires, C1424CEW, Argentina",ROSARIO,BARCO CENTENERA DEL y ROSARIO,6,-58.44110156,-34.62082399,MOTO-AUTO,MOTO,AUTO
2018-0024,1,2018-02-28,2018,2,28,2023-12-01 23:00:00,1970-01-01 00:00:00.000000023,Alvarez Thomas Av. y Donado,AVENIDA,ALVAREZ THOMAS AV.,"2102, Avenida Álvarez Thomas, Villa Ortúzar, Buenos Aires, Distrito Audiovisual, Comuna 15, Ciudad Autónoma de Buenos Aires, C1431FBB, Argentina",DONADO,ALVAREZ THOMAS AV. y DONADO,15,-58.47087351,-34.57827342,PEATON-CARGAS,PEATON,CARGAS
2018-0025,1,2018-03-04,2018,3,4,,1970-01-01 00:00:00.000000022,Av. Avellaneda y Av. Boyacá,AVENIDA,AVELLANEDA AV.,"1999, Avenida Avellaneda, Flores, Buenos Aires, Comuna 7, Ciudad Autónoma de Buenos Aires, C1406FYG, Argentina",BOYACA AV.,AVELLANEDA AV. y BOYACA AV.,7,-58.4596221,-34.6224514,PEATON-AUTO,PEATON,AUTO
2018-0026,2,2018-03-09,2018,3,9,2023-12-01 04:45:00,1970-01-01 00:00:00.000000004,"Rabanal, Francisco, Intendente Av. y Saenz Av.",AVENIDA,"RABANAL, FRANCISCO, INTENDENTE AV.","1301, Avenida Intendente Francisco Rabanal, Nueva Pompeya, Buenos Aires, Comuna 4, Ciudad Autónoma de Buenos Aires, C1437, Argentina",SAENZ AV.,"RABANAL, FRANCISCO, INTENDENTE AV. y SAENZ AV.",4,-58.41657793,-34.65476216,MOVIL-CARGAS,MOVIL,CARGAS
2018-0027,1,2018-03-11,2018,3,11,2023-12-01 23:00:00,1970-01-01 00:00:00.000000023,Castro y Rondeau,CALLE,CASTRO,"2099, Castro, Boedo, Buenos Aires, Comuna 5, Ciudad Autónoma de Buenos Aires, 1240, Argentina",RONDEAU,CASTRO y RONDEAU,5,-58.41911301,-34.63722107,PEATON-MOTO,PEATON,MOTO
2018-0028,1,2018-03-13,2018,3,13,2023-12-01 15:45:00,1970-01-01 00:00:00.000000015,"Bilbao, Francisco Av. y Azul",AVENIDA,"BILBAO, FRANCISCO AV.","Azul, Parque Avellaneda, Buenos Aires, Comuna 9, Ciudad Autónoma de Buenos Aires, C1406EZN, Argentina",AZUL,"BILBAO, FRANCISCO AV. y AZUL",9,-58.47120586,-34.64251042,PEATON-CARGAS,PEATON,CARGAS
2018-0029,1,2018-03-15,2018,3,15,2023-12-01 18:00:00,1970-01-01 00:00:00.000000018,Nazca Av. y Gaona Av.,AVENIDA,NAZCA AV.,"3500, Avenida Gaona, Flores, Buenos Aires, Comuna 7, Ciudad Autónoma de Buenos Aires, C1406AJW, Argentina",GAONA AV.,NAZCA AV. y GAONA AV.,11,-58.47418944,-34.62049672,MOTO-AUTO,MOTO,AUTO
2018-0030,1,2018-03-20,2018,3,20,2023-12-01 01:30:00,1970-01-01 00:00:00.000000001,Plaza y Alvarez Thomas Av.,AVENIDA,PLAZA,"1350, Plaza, Villa Ortúzar, Buenos Aires, Distrito Audiovisual, Comuna 15, Ciudad Autónoma de Buenos Aires, 1174, Argentina",ALVAREZ THOMAS AV.,PLAZA y ALVAREZ THOMAS AV.,15,-58.46720441,-34.57905579,MOTO-MOTO,MOTO,MOTO
2018-0031,1,2018-03-28,2018,3,28,2023-12-01 10:15:00,1970-01-01 00:00:00.000000010,"Gaona Av. y Artigas, Jose Gervasio, Gral.",AVENIDA,GAONA AV.,"3100, Avenida Gaona, Flores, Buenos Aires, Comuna 7, Ciudad Autónoma de Buenos Aires, 1404, Argentina","ARTIGAS, JOSE GERVASIO, GRAL.","GAONA AV. y ARTIGAS, JOSE GERVASIO, GRAL.",11,-58.46909362,-34.6177971,MOTO-CARGAS,MOTO,CARGAS
2018-0032,1,2018-04-02,2018,4,2,2023-12-01 13:00:00,1970-01-01 00:00:00.000000013,Cabildo Av. y Aguilar,AVENIDA,CABILDO AV.,"Aguilar, Palermo, Buenos Aires, Comuna 14, Ciudad Autónoma de Buenos Aires, C1426, Argentina",AGUILAR,CABILDO AV. y AGUILAR,13,-58.44704343,-34.5688864,PEATON-PASAJEROS,PEATON,PASAJEROS
2018-0033,1,2018-04-07,2018,4,7,,1970-01-01 00:00:00.000000007,Camarones y Lope De Vega Av.,AVENIDA,CAMARONES,"1100, Avenida Lope de Vega, Villa Luro, Buenos Aires, Comuna 10, Ciudad Autónoma de Buenos Aires, C1407BNL, Argentina",LOPE DE VEGA AV.,CAMARONES y LOPE DE VEGA AV.,10,-58.50535541,-34.62902048,MOTO-CARGAS,MOTO,CARGAS
2018-0034,1,2018-04-11,2018,4,11,2023-12-01 18:15:00,1970-01-01 00:00:00.000000018,Santa Fe Av. 2320,AVENIDA,SANTA FE AV.,2320.0,"2334, Avenida Santa Fe, Barrio Norte, Recoleta, Buenos Aires, Comuna 2, Ciudad Autónoma de Buenos Aires, C1123AAS, Argentina",SANTA FE AV. 2320,2,-58.40021675,-34.59522198,PEATON-PASAJEROS,PEATON,PASAJEROS
2018-0035,1,2018-04-12,2018,4,12,2023-12-01 16:45:00,1970-01-01 00:00:00.000000016,Av. Rivadavia 6950,AVENIDA,RIVADAVIA AV.,6950.0,"Basílica de San José de Flores, 6950, Avenida Rivadavia, Flores, Buenos Aires, Comuna 7, Ciudad Autónoma de Buenos Aires, C1406GLZ, Argentina",RIVADAVIA AV. 6950,7,-58.46325991,-34.62919627,PEATON-PASAJEROS,PEATON,PASAJEROS
2018-0036,1,2018-04-13,2018,4,13,2023-12-01 23:15:00,1970-01-01 00:00:00.000000023,Av. San Martín y Argerich,AVENIDA,SAN MARTIN AV.,"Metrobús San Martín, Villa del Parque, Buenos Aires, Comuna 11, Ciudad Autónoma de Buenos Aires, C1419HTH, Argentina",ARGERICH,SAN MARTIN AV. y ARGERICH,15,-58.49471482,-34.59694755,MOTO-AUTO,MOTO,AUTO
2018-0037,1,2018-04-18,2018,4,18,,1970-01-01 00:00:00.000000018,"Cordoba Av. y Uriburu Jose E., Pres.",AVENIDA,CORDOBA AV.,"2200, Avenida Córdoba, Balvanera, Buenos Aires, Comuna 3, Ciudad Autónoma de Buenos Aires, C1120AAQ, Argentina","URIBURU JOSE E., PRES.","CORDOBA AV. y URIBURU JOSE E., PRES.",2,-58.3987261,-34.59975962,PEATON-CARGAS,PEATON,CARGAS
2018-0038,2,2018-04-20,2018,4,20,,1970-01-01 00:00:00.000000017,AV. RIVADAVIA 1571,AVENIDA,RIVADAVIA AV.,1571.0,"1571, Avenida Rivadavia, San Nicolás, Buenos Aires, Comuna 1, Ciudad Autónoma de Buenos Aires, C1033AAF, Argentina",RIVADAVIA AV. 1571,1,-58.38872177,-34.60885045,PEATON-AUTO,PEATON,AUTO
2018-0039,1,2018-04-21,2018,4,21,,1970-01-01 00:00:00.000000022,AUTOPISTA LUGONES KM 4.7,AUTOPISTA,"LUGONES, LEOPOLDO AV.",,,,14,,,PEATON-AUTO,PEATON,AUTO
2018-0040,1,2018-04-27,2018,4,27,,1970-01-01 00:00:00.000000011,Ramon Freire y Virrey Olaguer y Feliu,CALLE,"FREIRE, RAMON, CAP. GRAL.","Tito Livio, 1395, Capitán General Ramón Freire, Colegiales, Buenos Aires, Comuna 13, Ciudad Autónoma de Buenos Aires, C1426EJP, Argentina","OLAGUER Y FELIU, VIRREY","FREIRE, RAMON, CAP. GRAL. y OLAGUER Y FELIU, VIRREY",13,-58.45686132,-34.57305993,PEATON-CARGAS,PEATON,CARGAS
2018-0041,1,2018-04-27,2018,4,27,2023-12-01 13:30:00,1970-01-01 00:00:00.000000013,"La Plata Av. y Fernandez De La Cruz, F., Gral. Av.",AVENIDA,LA PLATA AV.,"Avenida La Plata, Nueva Pompeya, Buenos Aires, Comuna 4, Ciudad Autónoma de Buenos Aires, 1263, Argentina","FERNANDEZ DE LA CRUZ, F., GRAL. AV.","LA PLATA AV. y FERNANDEZ DE LA CRUZ, F., GRAL. AV.",4,-58.42281627,-34.64282424,PEATON-PASAJEROS,PEATON,PASAJEROS
2018-0042,1,2018-04-27,2018,4,27,,1970-01-01 00:00:00.000000018,BRANDSEN y PERDRIEL,CALLE,BRANDSEN,"402, Perdriel, Barracas, Buenos Aires, Comuna 4, Ciudad Autónoma de Buenos Aires, 1284, Argentina",PERDRIEL,BRANDSEN y PERDRIEL,4,-58.38666024,-34.63953396,MOTO-CARGAS,MOTO,CARGAS
2018-0043,1,2018-04-28,2018,4,28,2023-12-01 06:30:00,1970-01-01 00:00:00.000000006,"Vilardebo, Teodoro y Alvarez Jonte Av.",AVENIDA,"VILARDEBO, TEODORO","3502, Álvarez Jonte, Villa Santa Rita, Buenos Aires, Comuna 11, Ciudad Autónoma de Buenos Aires, C1407GON, Argentina",ALVAREZ JONTE AV.,"VILARDEBO, TEODORO y ALVAREZ JONTE AV.",11,-58.49122843,-34.61207587,MOTO-AUTO,MOTO,AUTO
2018-0044,1,2018-04-28,2018,4,28,2023-12-01 09:00:00,1970-01-01 00:00:00.000000009,Alberti e Independencia Av.,AVENIDA,ALBERTI,"800, Alberti, Once, Balvanera, Buenos Aires, Comuna 3, Ciudad Autónoma de Buenos Aires, 1229, Argentina",INDEPENDENCIA AV.,ALBERTI e INDEPENDENCIA AV.,3,-58.40098306,-34.61866627,PEATON-AUTO,PEATON,AUTO
2018-0045,1,2018-04-30,2018,4,30,2023-12-01 07:00:00,1970-01-01 00:00:00.000000007,Alvarez Thomas Av. 879,AVENIDA,ALVAREZ THOMAS AV.,879.0,"885, Avenida Álvarez Thomas, Colegiales, Buenos Aires, Distrito Audiovisual, Comuna 13, Ciudad Autónoma de Buenos Aires, C1427CCG, Argentina",ALVAREZ THOMAS AV. 879,13,-58.45448963,-34.5791692,AUTO-CARGAS,AUTO,CARGAS
2018-0046,1,2018-05-02,2018,5,2,2023-12-01 03:15:00,1970-01-01 00:00:00.000000003,Av. Gral. Paz y Av. Rivadavia,GRAL PAZ,"PAZ, GRAL. AV.","Avenida Rivadavia, Liniers, Buenos Aires, Comuna 9, Ciudad Autónoma de Buenos Aires, C1408ABQ, Argentina",RIVADAVIA AV.,"PAZ, GRAL. AV. y RIVADAVIA AV.",9,-58.52927982,-34.63931752,PEATON-AUTO,PEATON,AUTO
2018-0047,1,2018-05-08,2018,5,8,,1970-01-01 00:00:00.000000019,Av. Corrientes y Av. Dorrego,AVENIDA,CORRIENTES AV.,"799, Avenida Dorrego, Chacarita, Buenos Aires, Distrito Audiovisual, Comuna 15, Ciudad Autónoma de Buenos Aires, C1414ALN, Argentina",DORREGO AV.,CORRIENTES AV. y DORREGO AV.,15,-58.44759966,-34.5917024,PEATON-PASAJEROS,PEATON,PASAJEROS
2018-0048,1,2018-05-09,2018,5,9,,1970-01-01 00:00:00.000000010,Rivadavia Av. y Pedernera,AVENIDA,RIVADAVIA AV.,"Pedernera, Flores, Buenos Aires, Comuna 7, Ciudad Autónoma de Buenos Aires, C1406GMA, Argentina",PEDERNERA,RIVADAVIA AV. y PEDERNERA,7,-58.46411215,-34.62925068,PEATON-PASAJEROS,PEATON,PASAJEROS
2018-0049,1,2018-05-11,2018,5,11,,1970-01-01 00:00:00.000000019,Quesada 2300,CALLE,QUESADA,2300.0,"2893, Vuelta de Obligado, Barrio Chino, Núñez, Buenos Aires, Comuna 13, Ciudad Autónoma de Buenos Aires, C1428ADS, Argentina",QUESADA 2300,13,-58.4621322,-34.55395823,PEATON-AUTO,PEATON,AUTO
2018-0050,1,2018-05-14,2018,5,14,2023-12-01 18:45:00,1970-01-01 00:00:00.000000018,Cabildo Av. y Juramento Av.,AVENIDA,CABILDO AV.,"Avenida Juramento, Barrio Chino, Belgrano, Buenos Aires, Comuna 13, Ciudad Autónoma de Buenos Aires, C1428AAP, Argentina",JURAMENTO AV.,CABILDO AV. y JURAMENTO AV.,13,-58.45669422,-34.5620361,PEATON-PASAJEROS,PEATON,PASAJEROS
2018-0051,1,2018-05-15,2018,5,15,2023-12-01 21:15:00,1970-01-01 00:00:00.000000021,"California y Carbonari, Francisco, Cmte.",CALLE,CALIFORNIA,"1800, Comandante Francisco Carbonari, La Boca, Buenos Aires, Distrito de Las Artes, Comuna 4, Ciudad Autónoma de Buenos Aires, C1169AAF, Argentina","CARBONARI, FRANCISCO, CMTE.","CALIFORNIA y CARBONARI, FRANCISCO, CMTE.",4,-58.3597716,-34.64341878,PEATON-AUTO,PEATON,AUTO
2018-0052,1,2018-05-18,2018,5,18,2023-12-01 20:30:00,1970-01-01 00:00:00.000000020,"Carril, Salvador Maria Del Av. y Nazca",AVENIDA,"CARRIL, SALVADOR MARIA DEL AV.","4100, Nazca, Agronomía, Buenos Aires, Comuna 15, Ciudad Autónoma de Buenos Aires, C1419HTH, Argentina",NAZCA,"CARRIL, SALVADOR MARIA DEL AV. y NAZCA",15,-58.49820145,-34.59070093,PEATON-PASAJEROS,PEATON,PASAJEROS
2018-0053,1,2018-05-20,2018,5,20,2023-12-01 02:30:00,1970-01-01 00:00:00.000000002,San Luis y Aguero,CALLE,SAN LUIS,"3200, San Luis, Abasto, Balvanera, Buenos Aires, Comuna 3, Ciudad Autónoma de Buenos Aires, 1189, Argentina",AGUERO,SAN LUIS y AGUERO,3,-58.4105928,-34.5993918,MOTO-AUTO,MOTO,AUTO
2018-0054,1,2018-05-22,2018,5,22,2023-12-01 11:15:00,1970-01-01 00:00:00.000000011,Lugones 2430,CALLE,LUGONES,2430.0,"2430, Lugones, Villa Urquiza, Buenos Aires, Comuna 12, Ciudad Autónoma de Buenos Aires, 1430, Argentina",LUGONES 2430,12,-58.47969138,-34.57121563,PEATON-BICICLETA,PEATON,BICICLETA
2018-0055,1,2018-05-29,2018,5,29,,1970-01-01 00:00:00.000000007,Independencia Av. y Jujuy Av.,AVENIDA,INDEPENDENCIA AV.,"2702, Avenida Independencia, San Cristóbal, Buenos Aires, Comuna 3, Ciudad Autónoma de Buenos Aires, C1225AAW, Argentina",JUJUY AV.,INDEPENDENCIA AV. y JUJUY AV.,3,-58.40351561,-34.61883916,MOTO-AUTO,MOTO,AUTO
2018-0056,1,2018-06-02,2018,6,2,,1970-01-01 00:00:00.000000013,Av. Rivadavia 11050,AVENIDA,RIVADAVIA AV.,11050.0,"3, Martiniano Leguizamón, Liniers, Buenos Aires, Comuna 9, Ciudad Autónoma de Buenos Aires, C1408AAX, Argentina",RIVADAVIA AV. 11050,9,-58.51973844,-34.63918987,PEATON-PASAJEROS,PEATON,PASAJEROS
2018-0057,1,2018-06-03,2018,6,3,,1970-01-01 00:00:00.000000003,Combate De Los Pozos y Humberto 1°,CALLE,COMBATE DE LOS POZOS,"1100, Combate de los Pozos, San Cristóbal, Buenos Aires, Comuna 3, Ciudad Autónoma de Buenos Aires, 1133, Argentina",HUMBERTO 1?,COMBATE DE LOS POZOS y HUMBERTO 1Â°,3,-58.39311376,-34.62163006,MOTO-PASAJEROS,MOTO,PASAJEROS
2018-0058,1,2018-06-03,2018,6,3,,1970-01-01 00:00:00.000000006,Cordoba Av. y Thames,AVENIDA,CORDOBA AV.,"1199, Thames, Villa Crespo, Buenos Aires, Comuna 15, Ciudad Autónoma de Buenos Aires, C1414DCN, Argentina",THAMES,CORDOBA AV. y THAMES,15,-58.43531242,-34.59082159,MOTO-AUTO,MOTO,AUTO
2018-0059,1,2018-06-08,2018,6,8,,1970-01-01 00:00:00.000000006,"Garay, Juan De Av. y Sanchez De Loria",AVENIDA,"GARAY, JUAN DE AV.","1702, Sánchez de Loria, Parque Patricios, Buenos Aires, Comuna 4, Ciudad Autónoma de Buenos Aires, 1258, Argentina",SANCHEZ DE LORIA,"GARAY, JUAN DE AV. y SANCHEZ DE LORIA",5,-58.41178165,-34.63035454,MOTO-MOVIL,MOTO,OTRO
2018-0060,1,2018-06-08,2018,6,8,,1970-01-01 00:00:00.000000012,"Lavalle y Alem, Leandro N. Av.",AVENIDA,LAVALLE,"502, Avenida Leandro N. Alem, Microcentro, San Nicolás, Buenos Aires, Comuna 1, Ciudad Autónoma de Buenos Aires, C1043AAC, Argentina","ALEM, LEANDRO N. AV.","LAVALLE y ALEM, LEANDRO N. AV.",1,-58.370488,-34.60189492,PEATON-PASAJEROS,PEATON,PASAJEROS
2018-0061,1,2018-06-10,2018,6,10,,1970-01-01 00:00:00.000000011,Estados Unidos y Pichincha,CALLE,ESTADOS UNIDOS,"901, Pichincha, San Cristóbal, Buenos Aires, Comuna 3, Ciudad Autónoma de Buenos Aires, 1082, Argentina",PICHINCHA,ESTADOS UNIDOS y PICHINCHA,3,-58.39883882,-34.61964833,MOTO-MOTO,MOTO,MOTO
2018-0062,1,2018-06-14,2018,6,14,,1970-01-01 00:00:00.000000001,Rosario y Barco Centenera Del,CALLE,ROSARIO,"5402, Avenida Rivadavia, Caballito, Buenos Aires, Comuna 6, Ciudad Autónoma de Buenos Aires, C1424CEW, Argentina",BARCO CENTENERA DEL,ROSARIO y BARCO CENTENERA DEL,6,-58.44110156,-34.62082399,PEATON-CARGAS,PEATON,CARGAS
2018-0063,1,2018-06-16,2018,6,16,,1970-01-01 00:00:00.000000021,Av. Leandro N. Alem y Viamonte,AVENIDA,"ALEM, LEANDRO N. AV.","702, Avenida Leandro N. Alem, Microcentro, San Nicolás, Buenos Aires, Comuna 1, Ciudad Autónoma de Buenos Aires, C1043AAA, Argentina",VIAMONTE,"ALEM, LEANDRO N. AV. y VIAMONTE",1,-58.37093138,-34.59952725,PEATON-PASAJEROS,PEATON,PASAJEROS
2018-0064,1,2018-06-25,2018,6,25,,1970-01-01 00:00:00.000000001,Varela Av. y Primera Junta,AVENIDA,VARELA AV.,"2602, Primera Junta, Flores, Buenos Aires, Comuna 7, Ciudad Autónoma de Buenos Aires, C1406EZN, Argentina",PRIMERA JUNTA,VARELA AV. y PRIMERA JUNTA,7,-58.45855262,-34.63953253,AUTO-CARGAS,AUTO,CARGAS
2018-0065,1,2018-06-26,2018,6,26,,1970-01-01 00:00:00.000000017,"Pellegrini, Carlos y Juncal",CALLE,"PELLEGRINI, CARLOS","1000, Juncal, Retiro, Buenos Aires, Comuna 1, Ciudad Autónoma de Buenos Aires, C1059ABQ, Argentina",JUNCAL,"PELLEGRINI, CARLOS y JUNCAL",1,-58.38161909,-34.59283447,MOTO-CARGAS,MOTO,CARGAS
2018-0066,1,2018-06-28,2018,6,28,,1970-01-01 00:00:00.000000011,Av. Corrientes y Av. Federico Lacroze,AVENIDA,CORRIENTES AV.,"4099, Avenida Federico Lacroze, Chacarita, Buenos Aires, Distrito Audiovisual, Comuna 15, Ciudad Autónoma de Buenos Aires, C1427BPG, Argentina","LACROZE, FEDERICO AV.","CORRIENTES AV. y LACROZE, FEDERICO AV.",15,-58.45511899,-34.58698157,PEATON-PASAJEROS,PEATON,PASAJEROS
2018-0067,1,2018-06-29,2018,6,29,,1970-01-01 00:00:00.000000016,"Montes De Oca, Manuel y Finochietto Enrique Dr.",AVENIDA,"MONTES DE OCA, MANUEL AV.","100, Avenida Manuel A. Montes de Oca, Barracas, Buenos Aires, Comuna 4, Ciudad Autónoma de Buenos Aires, C1270AAN, Argentina",FINOCHIETTO ENRIQUE DR.,"MONTES DE OCA, MANUEL AV. y FINOCHIETTO ENRIQUE DR.",4,-58.37724226,-34.62973033,PASAJEROS-AUTO,PASAJEROS,AUTO
2018-0068,1,2018-07-01,2018,7,1,,1970-01-01 00:00:00.000000009,"Carabobo Av. y Alberdi, Juan Bautista Av.",AVENIDA,CARABOBO AV.,"Prestigio, 209, Avenida Carabobo, Flores, Buenos Aires, Comuna 7, Ciudad Autónoma de Buenos Aires, C1406GRI, Argentina","ALBERDI, JUAN BAUTISTA AV.","CARABOBO AV. y ALBERDI, JUAN BAUTISTA AV.",7,-58.45546217,-34.62930339,MOTO-AUTO,MOTO,AUTO
2018-0069,1,2018-07-04,2018,7,4,,1970-01-01 00:00:00.000000021,"Córdoba Av. 2215

",AVENIDA,CORDOBA AV.,2215.0,"2201, Avenida Córdoba, Barrio Norte, Recoleta, Buenos Aires, Comuna 2, Ciudad Autónoma de Buenos Aires, C1120AAE, Argentina",CORDOBA AV. 2215,2,-58.39897064,-34.59954925,BICICLETA-PASAJEROS,BICICLETA,PASAJEROS
2018-0070,1,2018-07-07,2018,7,7,,1970-01-01 00:00:00.000000015,"Estados Unidos y Urquiza, Gral.",CALLE,ESTADOS UNIDOS,"3100, Estados Unidos, San Cristóbal, Buenos Aires, Comuna 3, Ciudad Autónoma de Buenos Aires, 1221, Argentina","URQUIZA, GRAL.","ESTADOS UNIDOS y URQUIZA, GRAL.",3,-58.40917826,-34.62126274,MOTO-PASAJEROS,MOTO,PASAJEROS
2018-0071,1,2018-07-10,2018,7,10,,1970-01-01 00:00:00.000000017,Moreno y Av. Huergo,AVENIDA,MORENO,"300, Avenida Ingeniero Huergo, Puerto Madero, Buenos Aires, Comuna 1, Ciudad Autónoma de Buenos Aires, C1042AAB, Argentina","HUERGO, ING. AV.","MORENO y HUERGO, ING. AV.",1,-58.36726348,-34.61099738,MOTO-CARGAS,MOTO,CARGAS
2018-0072,1,2018-07-11,2018,7,11,,1970-01-01 00:00:00.000000013,"AU Dellepiane kilometro 0.0, altura calle Montiel, sentido hacia el Centro Porteño",AUTOPISTA,AUTOPISTA DELLEPIANE LUIS TTE. GRAL.,"6702, Teniente General Luís Dellepiane, Villa Lugano, Buenos Aires, Distrito del Deporte, Comuna 8, Ciudad Autónoma de Buenos Aires, C1439EBA, Argentina","6702, Teniente General Luís Dellepiane, Villa Lugano, Buenos Aires, Distrito del Deporte, Comuna 8, Ciudad Autónoma de Buenos Aires, C1439EBA, Argentina",AUTOPISTA DELLEPIANE LUIS TTE. GRAL. y MONTIEL,8,-58.48267426,-34.68454456,MOTO-CARGAS,MOTO,CARGAS
2018-0073,1,2018-07-11,2018,7,11,,1970-01-01 00:00:00.000000015,"Iriarte, Gral. Av. 3400",AVENIDA,"IRIARTE, GRAL. AV.",3400.0,"2971, Luna, Villa 21-24, Barracas, Buenos Aires, Comuna 4, Ciudad Autónoma de Buenos Aires, C1437IFA, Argentina","IRIARTE, GRAL. AV. 3400",4,-58.39546165,-34.65168841,PEATON-CARGAS,PEATON,CARGAS
2018-0074,1,2018-07-14,2018,7,14,,1970-01-01 00:00:00.000000006,AV. JUAN B. ALBERDI 2968,AVENIDA,"ALBERDI, JUAN BAUTISTA AV.",2968.0,"Cristales para el Automovil, Avenida Juan Bautista Alberdi, Flores, Buenos Aires, Comuna 7, Ciudad Autónoma de Buenos Aires, C1406GSU, Argentina","ALBERDI, JUAN BAUTISTA AV. 2968",7,-58.46941984,-34.63376545,AUTO-CARGAS,AUTO,CARGAS
2018-0075,1,2018-07-15,2018,7,15,,1970-01-01 00:00:00.000000007,Del Libertador Av. y Ortiz De Ocampo,AVENIDA,DEL LIBERTADOR AV.,"2200, Avenida Del Libertador, Palermo Norte, Palermo, Buenos Aires, Comuna 14, Ciudad Autónoma de Buenos Aires, 1425AAJ, Argentina",ORTIZ DE OCAMPO,DEL LIBERTADOR AV. y ORTIZ DE OCAMPO,14,-58.40367321,-34.58129246,PEATON-AUTO,PEATON,AUTO
2018-0076,1,2018-07-16,2018,7,16,,1970-01-01 00:00:00.000000009,"Chavez, Jorge y Paz, Gral. Av.",CALLE,"CHAVEZ, JORGE","Jorge Chávez, Liniers, Buenos Aires, Comuna 9, Ciudad Autónoma de Buenos Aires, C1408IGK, Argentina","PAZ, GRAL. AV.","CHAVEZ, JORGE y PAZ, GRAL. AV.",9,-58.52932872,-34.65014993,AUTO-CARGAS,AUTO,CARGAS
2018-0077,1,2018-07-16,2018,7,16,,1970-01-01 00:00:00.000000023,"Urquiza, Gral. y Estados Unidos",CALLE,"URQUIZA, GRAL.","3100, Estados Unidos, San Cristóbal, Buenos Aires, Comuna 3, Ciudad Autónoma de Buenos Aires, 1221, Argentina",ESTADOS UNIDOS,"URQUIZA, GRAL. y ESTADOS UNIDOS",3,-58.40917826,-34.62126274,AUTO-CARGAS,AUTO,CARGAS
2018-0078,1,2018-07-21,2018,7,21,,1970-01-01 00:00:00.000000006,Paraguay y Sánchez De Bustamante,CALLE,PARAGUAY,"1398, Sánchez de Bustamante, Recoleta, Buenos Aires, Comuna 2, Ciudad Autónoma de Buenos Aires, C1187AAH, Argentina",SANCHEZ DE BUSTAMANTE,PARAGUAY y SANCHEZ DE BUSTAMANTE,2,-58.41264127,-34.59473294,PEATON-AUTO,PEATON,AUTO
2018-0079,1,2018-07-23,2018,7,23,,1970-01-01 00:00:00.000000007,"De Los Corrales Av. y Paz, Gral. Av.",GRAL PAZ,DE LOS CORRALES AV.,"Avenida de los Corrales, Mataderos, Buenos Aires, Comuna 9, Ciudad Autónoma de Buenos Aires, C1440AUN, Argentina","PAZ, GRAL. AV.","DE LOS CORRALES AV. y PAZ, GRAL. AV.",9,-58.50877521,-34.66977709,PEATON-CARGAS,PEATON,CARGAS
2018-0080,1,2018-07-25,2018,7,25,,1970-01-01 00:00:00.000000022,"Alberdi, Juan Bautista Av. y Carhue",AVENIDA,"ALBERDI, JUAN BAUTISTA AV.","2001, Carhué, Mataderos, Buenos Aires, Comuna 9, Ciudad Autónoma de Buenos Aires, C1440ABU, Argentina",CARHUE,"ALBERDI, JUAN BAUTISTA AV. y CARHUE",9,-58.51232237,-34.6590353,PEATON-AUTO,PEATON,AUTO
2018-0081,1,2018-07-29,2018,7,29,,1970-01-01 00:00:00.000000006,Castañares Av. y Rivera Indarte Av.,AVENIDA,CASTANARES AV.,"2402, Avenida Castañares, Bajo Flores, Flores, Buenos Aires, Comuna 7, Ciudad Autónoma de Buenos Aires, 1047, Argentina",RIVERA INDARTE AV.,CASTAÃ‘ARES AV. y RIVERA INDARTE AV.,7,-58.44744156,-34.64567171,MULTIPLE,PEATON,MULTIPLE
2018-0082,1,2018-08-01,2018,8,1,,1970-01-01 00:00:00.000000015,"Larrazabal y Garzon, Eugenio, Gral. Av.",AVENIDA,LARRAZABAL,"2100, Larrazábal, Mataderos, Buenos Aires, Comuna 9, Ciudad Autónoma de Buenos Aires, C1440ASX, Argentina","GARZON, EUGENIO, GRAL. AV.","LARRAZABAL y GARZON, EUGENIO, GRAL. AV.",9,-58.49441273,-34.65869968,MOTO-CARGAS,MOTO,CARGAS
2018-0083,1,2018-08-02,2018,8,2,,1970-01-01 00:00:00.000000005,"Paz, Gral. Av. y Fernandez De La Cruz, F., Gral. Av.",GRAL PAZ,"PAZ, GRAL. AV.","Avenida General Paz, Villa Riachuelo, Villa Celina, Distrito del Deporte, Partido de La Matanza, Buenos Aires, 1772, Argentina","FERNANDEZ DE LA CRUZ, F., GRAL. AV.","PAZ, GRAL. AV. y FERNANDEZ DE LA CRUZ, F., GRAL. AV.",8,-58.47976785,-34.69153196,MOTO-CARGAS,MOTO,CARGAS
2018-0084,1,2018-08-03,2018,8,3,,1970-01-01 00:00:00.000000007,Av. Alicia Moreau de Justo y Cochabamba,AVENIDA,"MOREAU DE JUSTO, ALICIA AV.","2000, Avenida Alicia Moreau de Justo, Puerto Madero, Buenos Aires, Comuna 1, Ciudad Autónoma de Buenos Aires, C1063ADN, Argentina",COCHABAMBA,"MOREAU DE JUSTO, ALICIA AV. y COCHABAMBA",1,-58.36523349,-34.62260331,PEATON-CARGAS,PEATON,CARGAS
2018-0085,2,2018-08-03,2018,8,3,,1970-01-01 00:00:00.000000018,"Entre Rios Av. y Garay, Juan De Av.",AVENIDA,ENTRE RIOS AV.,"1581, Avenida Entre Ríos, San Cristóbal, Buenos Aires, Comuna 3, Ciudad Autónoma de Buenos Aires, 1151, Argentina","GARAY, JUAN DE AV.","ENTRE RIOS AV. y GARAY, JUAN DE AV.",3,-58.39118948,-34.62704273,MOTO-PASAJEROS,MOTO,PASAJEROS
2018-0086,1,2018-08-10,2018,8,10,,1970-01-01 00:00:00.000000021,Directorio Av. y Guardia Nacional,AVENIDA,DIRECTORIO AV.,"1401, Guardia Nacional, Mataderos, Buenos Aires, Comuna 9, Ciudad Autónoma de Buenos Aires, C1440ASO, Argentina",GUARDIA NACIONAL,DIRECTORIO AV. y GUARDIA NACIONAL,9,-58.49019551,-34.65015854,PEATON-PASAJEROS,PEATON,PASAJEROS
2018-0087,1,2018-08-15,2018,8,15,2023-12-01 19:20:00,1970-01-01 00:00:00.000000019,Pavon Av. Y Colombres,AVENIDA,PAVON AV.,"Policolor, 3700, Avenida Pavón, Boedo, Buenos Aires, Comuna 5, Ciudad Autónoma de Buenos Aires, 1240, Argentina",COLOMBRES,PAVON AV. y COLOMBRES,5,-58.41644362,-34.63023775,PEATON-PASAJEROS,PEATON,PASAJEROS
2018-0088,1,2018-08-17,2018,8,17,,1970-01-01 00:00:00.000000016,Av. Gral. Paz y Av. Dr. Ricardo Balbín,GRAL PAZ,"PAZ, GRAL. AV.","Avenida Doctor Ricardo Balbín, Saavedra, Buenos Aires, Comuna 12, Ciudad Autónoma de Buenos Aires, B1603, Argentina","BALBIN, RICARDO, DR. AV.","PAZ, GRAL. AV. y BALBIN, RICARDO, DR. AV.",12,-58.5007381,-34.5497951,MOTO-CARGAS,MOTO,CARGAS
2018-0089,1,2018-08-17,2018,8,17,2023-12-01 17:56:00,1970-01-01 00:00:00.000000017,Pichincha Av. y Brasil,AVENIDA,PICHINCHA AV.,"Avenida Pichincha, Parque Patricios, Buenos Aires, Comuna 4, Ciudad Autónoma de Buenos Aires, 1249, Argentina",BRASIL,PICHINCHA AV. y BRASIL,4,-58.39626094,-34.63036565,PEATON-PASAJEROS,PEATON,PASAJEROS
2018-0090,1,2018-08-18,2018,8,18,2023-12-01 10:34:00,1970-01-01 00:00:00.000000010,27 De Febrero Av. y Pergamino,AVENIDA,27 DE FEBRERO AV.,"3997, Avenida Pergamino, Villa Soldati, Buenos Aires, Distrito del Deporte, Comuna 8, Ciudad Autónoma de Buenos Aires, C1437CEE, Argentina",PERGAMINO,27 DE FEBRERO AV. y PERGAMINO,8,-58.43284809,-34.67051543,MOTO-AUTO,MOTO,AUTO
2018-0091,1,2018-08-19,2018,8,19,,1970-01-01 00:00:00.000000018,AU Perito Moreno KM 1.8 ALTURA BARRAGAN SENTIDO PBA,AUTOPISTA,AUTOPISTA PERITO MORENO,"301, Barragán, Liniers, Buenos Aires, Comuna 9, Ciudad Autónoma de Buenos Aires, C1408AAK, Argentina",BARRAGAN,AUTOPISTA PERITO MORENO y BARRAGAN,9,-58.52280139,-34.63659934,AUTO-AUTO,AUTO,AUTO
2018-0092,1,2018-08-20,2018,8,20,2023-12-01 08:20:00,1970-01-01 00:00:00.000000008,Cordoba Av. y Gascon,AVENIDA,CORDOBA AV.,"Gascón, Villa Crespo, Buenos Aires, Comuna 15, Ciudad Autónoma de Buenos Aires, C1185AAN, Argentina",GASCON,CORDOBA AV. y GASCON,14,-58.4233693,-34.59774487,MOTO-AUTO,MOTO,AUTO
2018-0093,1,2018-08-20,2018,8,20,2023-12-01 08:41:00,1970-01-01 00:00:00.000000008,15 De Noviembre De 1889 1513,CALLE,15 DE NOVIEMBRE DE 1889,1513.0,"1893, Presidente Luis Sáenz Peña, Constitución, Buenos Aires, Comuna 1, Ciudad Autónoma de Buenos Aires, C1280AEB, Argentina",15 DE NOVIEMBRE DE 1889 1513,1,-58.38691681,-34.63105973,PEATON-PASAJEROS,PEATON,PASAJEROS
2018-0094,1,2018-08-23,2018,8,23,2023-12-01 05:35:00,1970-01-01 00:00:00.000000005,"Salguero, Jeronimo y Beruti",CALLE,"SALGUERO, JERONIMO","2202, Jerónimo Salguero, Alto Palermo, Palermo, Buenos Aires, Comuna 14, Ciudad Autónoma de Buenos Aires, C1425BGI, Argentina",BERUTI,"SALGUERO, JERONIMO y BERUTI",14,-58.4116902,-34.5857988,MOTO-PASAJEROS,MOTO,PASAJEROS
2018-0095,1,2018-08-26,2018,8,26,2023-12-01 00:59:00,1970-01-01 00:00:00.000000000,"Lacarra Av. y Dellepiane, Luis, Tte. Gral.",AVENIDA,LACARRA AV.,"Lacarra, Parque Avellaneda, Buenos Aires, Comuna 9, Ciudad Autónoma de Buenos Aires, C1407, Argentina","DELLEPIANE, LUIS, TTE. GRAL.","LACARRA AV. y DELLEPIANE, LUIS, TTE. GRAL.",9,-58.46739825,-34.65117757,AUTO-AUTO,AUTO,AUTO
