ID,N_VICTIMAS,FECHA,AAAA,MM,DD,HORA,HH,LUGAR_DEL_HECHO,TIPO_DE_CALLE,Calle,Altura,Cruce,Dirección Normalizada,COMUNA,pos x,pos y,PARTICIPANTES,VICTIMA,ACUSADO
2019-0100,1,2019-12-05,2019,12,5,,1970-01-01 00:00:00.000000017,de los constituyentes av. 4300,AVENIDA,DE LOS CONSTITUYENTES AV.,4300.0,"2112, Habana, Villa Pueyrredón, Buenos Aires, Comuna 12, Ciudad Autónoma de Buenos Aires, 1419, Argentina",DE LOS CONSTITUYENTES AV. 4300,12,-58.49040794,-34.58368803,MOTO-AUTO,MOTO,AUTO
2019-0101,1,2019-12-17,2019,12,17,,1970-01-01 00:00:00.000000004,"MORENO, PERITO AV. Y TILCARA AV.",AVENIDA,"MORENO, PERITO AV.","2961, Avenida Tilcara, Nueva Pompeya, Buenos Aires, Comuna 4, Ciudad Autónoma de Buenos Aires, C1437FHG, Argentina",TILCARA AV.,"MORENO, PERITO AV. y TILCARA AV.",4,-58.42102679,-34.64991178,MOTO-MOTO,MOTO,MOTO
2019-0102,1,2019-12-17,2019,12,17,,1970-01-01 00:00:00.000000014,"IBARROLA Y GORDILLO, TIMOTEO",CALLE,IBARROLA,"201, Timoteo Gordillo, Liniers, Buenos Aires, Comuna 9, Ciudad Autónoma de Buenos Aires, C1408AAY, Argentina","GORDILLO, TIMOTEO","IBARROLA y GORDILLO, TIMOTEO",9,-58.52219407,-34.64143926,MOTO-AUTO,MOTO,AUTO
2019-0103,1,2019-12-18,2019,12,18,,,"PAZ, GRAL. AV. Y GRIVEO",GRAL PAZ,"PAZ, GRAL. AV.","3999, 2 - Avenida General Paz, Villa Devoto, Villa Lynch, Partido de General San Martín, Buenos Aires, B1672ASB, Argentina",GRIVEO,"PAZ, GRAL. AV. y GRIVEO",11,-58.52169422,-34.5947164,MOTO-MOTO,MOTO,MOTO
2019-0104,1,2019-12-21,2019,12,21,,1970-01-01 00:00:00.000000004,RIVADAVIA AV. Y PERGAMINO,AVENIDA,RIVADAVIA AV.,"1, Campana, Floresta, Buenos Aires, Comuna 10, Ciudad Autónoma de Buenos Aires, C1407DYN, Argentina",PERGAMINO,RIVADAVIA AV. y PERGAMINO,10,-58.47460416,-34.63206174,MOTO-AUTO,MOTO,AUTO
2019-0105,1,2019-05-05,2019,5,5,,1970-01-01 00:00:00.000000011,SANTO TOME Y SEGUROLA AV.,AVENIDA,SANTO TOME,"2300, Segurola, Monte Castro, Buenos Aires, Comuna 10, Ciudad Autónoma de Buenos Aires, C1407GPO, Argentina",SEGUROLA AV.,SANTO TOME y SEGUROLA AV.,10,-58.50512382,-34.61520391,PEATON-AUTO,PEATON,AUTO
2020-0001,1,2020-01-04,2020,1,4,,1970-01-01 00:00:00.000000010,URIARTE Y LOYOLA,CALLE,URIARTE,"1000, Loyola, Villa Crespo, Buenos Aires, Comuna 15, Ciudad Autónoma de Buenos Aires, 1414, Argentina",LOYOLA,URIARTE y LOYOLA,15,-58.43910409,-34.59213355,PEATON-AUTO,PEATON,AUTO
2020-0002,1,2020-01-05,2020,1,5,,1970-01-01 00:00:00.000000020,SARAZA Y VARELA AV.,AVENIDA,SARAZA,"2599, Saraza, Bajo Flores, Flores, Buenos Aires, Comuna 7, Ciudad Autónoma de Buenos Aires, 1047, Argentina",VARELA AV.,SARAZA y VARELA AV.,7,-58.45019436,-34.64646409,MOTO-OBJETO FIJO,MOTO,OBJETO FIJO
2020-0003,1,2020-01-11,2020,1,11,,1970-01-01 00:00:00.000000006,RIVADAVIA AV. Y COMBATE DE LOS POZOS,AVENIDA,RIVADAVIA AV.,"1899, Avenida Rivadavia, Balvanera, Buenos Aires, Comuna 3, Ciudad Autónoma de Buenos Aires, C1033AAI, Argentina",COMBATE DE LOS POZOS,RIVADAVIA AV. y COMBATE DE LOS POZOS,3,-58.39337644,-34.60927582,PEATON-AUTO,PEATON,AUTO
2020-0004,1,2020-01-14,2020,1,14,,1970-01-01 00:00:00.000000021,RODRIGUEZ PEÑA Y RIVADAVIA AV.,AVENIDA,RODRIGUEZ PE?A,"1699, Avenida Rivadavia, San Nicolás, Buenos Aires, Comuna 1, Ciudad Autónoma de Buenos Aires, C1033AAG, Argentina",RIVADAVIA AV.,RODRIGUEZ PEÃ‘A y RIVADAVIA AV.,1,-58.39055614,-34.60919284,PEATON-PASAJEROS,PEATON,PASAJEROS
2020-0005,1,2020-01-14,2020,1,14,,1970-01-01 00:00:00.000000006,24 DE NOVIEMBRE Y SAN JUAN AV.,AVENIDA,24 DE NOVIEMBRE,"1202, Oruro, San Cristóbal, Buenos Aires, Comuna 3, Ciudad Autónoma de Buenos Aires, C1233ABC, Argentina",SAN JUAN AV.,24 DE NOVIEMBRE y SAN JUAN AV.,3,-58.41036975,-34.62477021,MOTO-PASAJEROS,MOTO,PASAJEROS
2020-0006,1,2020-01-20,2020,1,20,,1970-01-01 00:00:00.000000012,LAFUENTE AV. 2250,AVENIDA,LAFUENTE AV.,2250.0,"Campo Club Italiano, Avenida Perito Moreno, Villa Soldati, Buenos Aires, Distrito del Deporte, Comuna 8, Ciudad Autónoma de Buenos Aires, 1047, Argentina",LAFUENTE AV. 2250,8,-58.44925765,-34.65412546,MOTO-CARGAS,MOTO,CARGAS
2020-0007,1,2020-01-27,2020,1,27,,1970-01-01 00:00:00.000000000,CHILE Y LIMA ,CALLE,CHILE,"699, Lima, Monserrat, Buenos Aires, Comuna 1, Ciudad Autónoma de Buenos Aires, 1073, Argentina",LIMA,CHILE y LIMA,1,-58.3815685,-34.61648696,PEATON-MOTO,PEATON,MOTO
2020-0008,1,2020-01-30,2020,1,30,,1970-01-01 00:00:00.000000007,CORDOBA AV. Y JEAN JAURES,AVENIDA,CORDOBA AV.,"2800, Avenida Córdoba, Abasto, Balvanera, Buenos Aires, Comuna 3, Ciudad Autónoma de Buenos Aires, C1187AAO, Argentina","JAURES, JEAN","CORDOBA AV. y JAURES, JEAN",2,-58.40662899,-34.59804521,MOTO-CARGAS,MOTO,CARGAS
2020-0009,1,2020-02-04,2020,2,4,,1970-01-01 00:00:00.000000014,"PERON, JUAN DOMINGO, TTE. GENERAL Y SALGUERO, JERONIMO",CALLE,"PERON, JUAN DOMINGO, TTE. GENERAL","402, Jerónimo Salguero, Almagro, Buenos Aires, Comuna 5, Ciudad Autónoma de Buenos Aires, 1177, Argentina","SALGUERO, JERONIMO","PERON, JUAN DOMINGO, TTE. GENERAL y SALGUERO, JERONIMO",5,-58.41985649,-34.6060085,PEATON-AUTO,PEATON,AUTO
2020-0010,1,2020-02-08,2020,2,8,,1970-01-01 00:00:00.000000005,9 DE JULIO AV. Y SAN JUAN AV.,AVENIDA,9 DE JULIO AV.,"Avenida San Juan, Constitución, Buenos Aires, Comuna 1, Ciudad Autónoma de Buenos Aires, C1046AAD, Argentina",SAN JUAN AV.,9 DE JULIO AV. y SAN JUAN AV.,1,-58.38099833,-34.62214953,MOTO-OBJETO FIJO,MOTO,OBJETO FIJO
2020-0011,1,2020-02-12,2020,2,12,,1970-01-01 00:00:00.000000011,COLOMBRES 466,CALLE,COLOMBRES,466.0,"470, Colombres, Almagro, Buenos Aires, Comuna 5, Ciudad Autónoma de Buenos Aires, C1126AAC, Argentina",COLOMBRES 466,5,-58.41803309,-34.61823178,MOTO-CARGAS,MOTO,CARGAS
2020-0012,1,2020-02-18,2020,2,18,,1970-01-01 00:00:00.000000021,MEXICO 2860,CALLE,MEXICO,2860.0,"2858, México, Balvanera, Buenos Aires, Comuna 3, Ciudad Autónoma de Buenos Aires, C1231AAB, Argentina",MEXICO 2860,3,-58.40604003,-34.61783553,PEATON-MOTO,PEATON,MOTO
2020-0013,1,2020-02-20,2020,2,20,,1970-01-01 00:00:00.000000012,COMBATIENTES DE MALVINAS AV. Y TRIUNVITARO AV.,AVENIDA,COMBATIENTES DE MALVINAS AV.,"3902, Avenida Triunvirato, Parque Chas, Buenos Aires, Distrito Audiovisual, Comuna 15, Ciudad Autónoma de Buenos Aires, C1431FBB, Argentina",TRIUNVIRATO AV.,COMBATIENTES DE MALVINAS AV. y TRIUNVIRATO AV.,15,-58.47549929,-34.57994061,PEATON-MOTO,PEATON,MOTO
2020-0014,1,2020-02-27,2020,2,27,,1970-01-01 00:00:00.000000002,BERMUDEZ Y NOGOYA,CALLE,BERMUDEZ,"4999, Nogoyá, Villa Devoto, Buenos Aires, Comuna 11, Ciudad Autónoma de Buenos Aires, 1417, Argentina",NOGOYA,BERMUDEZ y NOGOYA,11,-58.51398484,-34.61600366,MOTO-PASAJEROS,MOTO,PASAJEROS
2020-0015,1,2020-02-28,2020,2,28,,1970-01-01 00:00:00.000000014,BRASIL AV. Y PASEO COLON AV.,AVENIDA,BRASIL AV.,"Avenida Brasil, San Telmo, Buenos Aires, Distrito de Las Artes, Comuna 1, Ciudad Autónoma de Buenos Aires, C1063ADN, Argentina",PASEO COLON AV.,BRASIL AV. y PASEO COLON AV.,1,-58.36797542,-34.62519403,MOTO-PASAJEROS,MOTO,PASAJEROS
2020-0016,1,2020-02-29,2020,2,29,,1970-01-01 00:00:00.000000013,"ALEM,LEANDRO N. AV. 770",AVENIDA,"ALEM, LEANDRO N. AV.",770.0,"773, 25 de Mayo, Microcentro, San Nicolás, Buenos Aires, Comuna 1, Ciudad Autónoma de Buenos Aires, C1001AAQ, Argentina","ALEM, LEANDRO N. AV. 770",1,-58.37133616,-34.59879316,PEATON-PASAJEROS,PEATON,PASAJEROS
2020-0017,1,2020-03-05,2020,3,5,,1970-01-01 00:00:00.000000023,BELGRANO AV. Y RINCON,AVENIDA,BELGRANO AV.,"2100, Avenida Belgrano, Once, Balvanera, Buenos Aires, Comuna 3, Ciudad Autónoma de Buenos Aires, 1082, Argentina",RINCON,BELGRANO AV. y RINCON,3,-58.39613805,-34.61413568,PEATON-AUTO,PEATON,AUTO
2020-0018,1,2020-03-09,2020,3,9,,1970-01-01 00:00:00.000000014,"UDAONDO, GUILLERMO AV. 901",AVENIDA,"UDAONDO, GUILLERMO AV.",901.0,"Avenida Intendente Cantilo, Barrio River, Belgrano, Buenos Aires, Comuna 13, Ciudad Autónoma de Buenos Aires, C1424BCL, Argentina","UDAONDO, GUILLERMO AV. 901",13,-58.44903073,-34.54200276,MOTO-OBJETO FIJO,MOTO,OBJETO FIJO
2020-0019,1,2020-03-10,2020,3,10,,1970-01-01 00:00:00.000000021,CONSTITUCION Y CASTRO,CALLE,CONSTITUCION,"1300, Castro, Boedo, Buenos Aires, Comuna 5, Ciudad Autónoma de Buenos Aires, 1253, Argentina",CASTRO,CONSTITUCION y CASTRO,5,-58.41972364,-34.6284667,PEATON-AUTO,PEATON,AUTO
2020-0020,1,2020-03-13,2020,3,13,,1970-01-01 00:00:00.000000017,"PUEYRREDON AV. Y GOMEZ, VALENTIN",AVENIDA,PUEYRREDON AV.,"402, Avenida Pueyrredón, Once, Balvanera, Buenos Aires, Comuna 3, Ciudad Autónoma de Buenos Aires, C1032, Argentina","GOMEZ, VALENTIN","PUEYRREDON AV. y GOMEZ, VALENTIN",3,-58.40571596,-34.60557123,PEATON-MOTO,PEATON,MOTO
2020-0021,1,2020-03-14,2020,3,14,,1970-01-01 00:00:00.000000016,"BRAVO, MARIO 1279",CALLE,"BRAVO, MARIO",1279.0,"La U de Palermo, 1295, Mario Bravo, Recoleta, Buenos Aires, Comuna 2, Ciudad Autónoma de Buenos Aires, C1186AAN, Argentina","BRAVO, MARIO 1279",2,-58.4145159,-34.59488319,PEATON-AUTO,PEATON,AUTO
2020-0022,1,2020-04-07,2020,4,7,,1970-01-01 00:00:00.000000006,"DELLEPIANE, LUIS, TTE. GRAL. Y ESCALADA AV.",AUTOPISTA,AUTOPISTA DELLEPIANE LUIS TTE. GRAL.,"Avenida Escalada, Villa Lugano, Buenos Aires, Distrito del Deporte, Comuna 8, Ciudad Autónoma de Buenos Aires, C1407IVT, Argentina",ESCALADA AV.,AUTOPISTA DELLEPIANE LUIS TTE. GRAL. y ESCALADA AV.,9,-58.47297505,-34.66245085,AUTO-CARGAS,AUTO,CARGAS
2020-0023,1,2020-04-09,2020,4,9,,1970-01-01 00:00:00.000000018,"ARAOZ DE LAMADRID, GREGORIO, GRAL. Y BROWN, ALTE. AV.",AVENIDA,"ARAOZ DE LAMADRID, GREGORIO, GRAL.","402, General Gregorio Aráoz de Lamadrid, La Boca, Buenos Aires, Distrito de Las Artes, Comuna 4, Ciudad Autónoma de Buenos Aires, C1166AAG, Argentina","BROWN, ALTE. AV.","ARAOZ DE LAMADRID, GREGORIO, GRAL. y BROWN, ALTE. AV.",4,-58.35791192,-34.63695178,AUTO-CARGAS,AUTO,CARGAS
2020-0024,1,2020-04-24,2020,4,24,,1970-01-01 00:00:00.000000007,MURGUIONDO 1339,CALLE,MURGUIONDO,1339.0,"Jardín de Infantes Nucleado C (EPCjc 20/20°), 1347, Murguiondo, Mataderos, Buenos Aires, Comuna 9, Ciudad Autónoma de Buenos Aires, 1440, Argentina",MURGUIONDO 1339,9,-58.50801713,-34.65177305,AUTO-AUTO,AUTO,AUTO
2020-0025,1,2020-05-12,2020,5,12,,1970-01-01 00:00:00.000000005,RIVADAVIA AV. 2551,AVENIDA,RIVADAVIA AV.,2551.0,"2547, Avenida Rivadavia, Once, Balvanera, Buenos Aires, Comuna 3, Ciudad Autónoma de Buenos Aires, C1034ACE, Argentina",RIVADAVIA AV. 2551,3,-58.40258477,-34.60975108,PEATON-AUTO,PEATON,AUTO
2020-0026,1,2020-05-17,2020,5,17,,1970-01-01 00:00:00.000000006,"LUGONES, LEOPOLDO AV. KM 6,1",AUTOPISTA,"LUGONES, LEOPOLDO AV.",,,,14,,,MOTO-OBJETO FIJO,MOTO,OBJETO FIJO
2020-0027,1,2020-05-18,2020,5,18,,1970-01-01 00:00:00.000000008,"DELLEPIANE, LUIS, TTE. GRAL. Y MONTIEL",AVENIDA,"DELLEPIANE, LUIS, TTE. GRAL.","6702, Teniente General Luís Dellepiane, Villa Lugano, Buenos Aires, Distrito del Deporte, Comuna 8, Ciudad Autónoma de Buenos Aires, C1439EBA, Argentina",MONTIEL,"DELLEPIANE, LUIS, TTE. GRAL. y MONTIEL",8,-58.48267426,-34.68454456,PEATON-CARGAS,PEATON,CARGAS
2020-0028,1,2020-05-19,2020,5,19,,1970-01-01 00:00:00.000000010,"SCALABRINI ORTIZ, RAUL AV. Y WARNES AV.",AVENIDA,"SCALABRINI ORTIZ, RAUL AV.","Avenida Raúl Scalabrini Ortiz, Villa Crespo, Buenos Aires, Comuna 15, Ciudad Autónoma de Buenos Aires, C1414DLC, Argentina",WARNES AV.,"SCALABRINI ORTIZ, RAUL AV. y WARNES AV.",15,-58.44248936,-34.60221948,PEATON-PASAJEROS,PEATON,PASAJEROS
2020-0029,1,2020-06-10,2020,6,10,,1970-01-01 00:00:00.000000014,"PAZ, GRAL. AV. y ROFFO, ANGEL H., DR.",GRAL PAZ,"PAZ, GRAL. AV.","7100, Doctor Ángel Honorio Roffo, Liniers, Buenos Aires, Comuna 9, Ciudad Autónoma de Buenos Aires, C1408ABQ, Argentina","ROFFO, ANGEL H., DR.","PAZ, GRAL. AV. y ROFFO, ANGEL H., DR.",9,-58.52909134,-34.63886726,PEATON-PASAJEROS,PEATON,PASAJEROS
2020-0030,1,2020-06-16,2020,6,16,,1970-01-01 00:00:00.000000015,SAN MARTIN AV. 1550,AVENIDA,SAN MARTIN AV.,1550.0,"1554, Avenida San Martín, Caballito, Buenos Aires, Comuna 6, Ciudad Autónoma de Buenos Aires, C1416CRR, Argentina",SAN MARTIN AV. 1550,6,-58.45158942,-34.6064658,MULTIPLE,MOTO,MULTIPLE
2020-0031,1,2020-06-30,2020,6,30,,1970-01-01 00:00:00.000000008,"GARZON, EUGENIO, GRAL. AV. y LARRAYA",AVENIDA,"GARZON, EUGENIO, GRAL. AV.","2101, Larraya, Mataderos, Buenos Aires, Comuna 9, Ciudad Autónoma de Buenos Aires, C1440ASV, Argentina",LARRAYA,"GARZON, EUGENIO, GRAL. AV. y LARRAYA",9,-58.49344309,-34.65788529,MOTO-CARGAS,MOTO,CARGAS
2020-0032,1,2020-07-10,2020,7,10,,1970-01-01 00:00:00.000000023,CORRIENTES AV. Y SERRANO,AVENIDA,CORRIENTES AV.,"499, Serrano, Villa Crespo, Buenos Aires, Comuna 15, Ciudad Autónoma de Buenos Aires, C1414AJJ, Argentina",SERRANO,CORRIENTES AV. y SERRANO,15,-58.44259166,-34.59635137,MOTO-AUTO,MOTO,AUTO
2020-0033,1,2020-07-19,2020,7,19,,1970-01-01 00:00:00.000000006,"PAZ, GRAL. AV. Y DEL LIBERTADOR AV.",GRAL PAZ,"PAZ, GRAL. AV.","1, Avenida del Libertador, Vicente López, Partido de Vicente López, Buenos Aires, C1429BNS, Argentina",DEL LIBERTADOR AV.,"PAZ, GRAL. AV. y DEL LIBERTADOR AV.",13,-58.46743471,-34.53476874,AUTO-OBJETO FIJO,AUTO,OBJETO FIJO
2020-0034,1,2020-08-02,2020,8,2,,1970-01-01 00:00:00.000000003,"MITRE, BARTOLOME Y ANCHORENA, TOMAS MANUEL DE, DR.",CALLE,"MITRE, BARTOLOME","3200, Bartolomé Mitre, Once, Balvanera, Buenos Aires, Comuna 3, Ciudad Autónoma de Buenos Aires, C1203AAD, Argentina","ANCHORENA, TOMAS MANUEL DE, DR.","MITRE, BARTOLOME y ANCHORENA, TOMAS MANUEL DE, DR.",3,-58.41178158,-34.60922259,PEATON-AUTO,PEATON,AUTO
2020-0035,1,2020-08-04,2020,8,4,,1970-01-01 00:00:00.000000005,"AU 25 DE MAYO ALTURA PUMACAHUA Y RECUERO, CASIMIRO, TTE. CNEL.",AUTOPISTA,AUTOPISTA 25 DE MAYO,"927, Pumacahua, Parque Chacabuco, Buenos Aires, Comuna 7, Ciudad Autónoma de Buenos Aires, C1406GRU, Argentina","927, Pumacahua, Parque Chacabuco, Buenos Aires, Comuna 7, Ciudad Autónoma de Buenos Aires, C1406GRU, Argentina",AUTOPISTA 25 DE MAYO y PUMACAHUA,7,-58.45068621,-34.63638927,MOTO-PASAJEROS,MOTO,PASAJEROS
2020-0036,1,2020-08-07,2020,8,7,,1970-01-01 00:00:00.000000018,"SCALABRINI ORTIZ, RAUL AV. Y PARAGUAY",AVENIDA,"SCALABRINI ORTIZ, RAUL AV.","2099, Avenida Raúl Scalabrini Ortiz, Palermo Soho, Palermo, Buenos Aires, Comuna 14, Ciudad Autónoma de Buenos Aires, C1425DBB, Argentina",PARAGUAY,"SCALABRINI ORTIZ, RAUL AV. y PARAGUAY",14,-58.42016954,-34.5877879,PEATON-MOTO,PEATON,MOTO
2020-0037,1,2020-08-29,2020,8,29,,1970-01-01 00:00:00.000000004,"FERNANDEZ DE LA CRUZ, F., GRAL. AV. Y VARELA AV.",AVENIDA,"FERNANDEZ DE LA CRUZ, F., GRAL. AV.","Avenida General Francisco Fernández de La Cruz, Villa Soldati, Buenos Aires, Distrito del Deporte, Comuna 8, Ciudad Autónoma de Buenos Aires, C1437BJP, Argentina",VARELA AV.,"FERNANDEZ DE LA CRUZ, F., GRAL. AV. y VARELA AV.",8,-58.43850413,-34.65554754,PEATON-AUTO,PEATON,AUTO
2020-0038,2,2020-08-30,2020,8,30,,1970-01-01 00:00:00.000000004,"LAS HERAS GENERAL AV. Y DIAZ, CNEL. AV.",AVENIDA,LAS HERAS GENERAL AV.,"Avenida Coronel Díaz, Recoleta, Buenos Aires, Comuna 2, Ciudad Autónoma de Buenos Aires, C1425DTS, Argentina","DIAZ, CNEL. AV.","LAS HERAS GENERAL AV. y DIAZ, CNEL. AV.",14,-58.40617526,-34.58345898,AUTO-AUTO,AUTO,AUTO
2020-0039,1,2020-09-01,2020,9,1,,1970-01-01 00:00:00.000000019,MURGUIONDO 2700,CALLE,MURGUIONDO,,,MURGUIONDO,9,,,PEATON-CARGAS,PEATON,CARGAS
2020-0040,1,2020-09-12,2020,9,12,,1970-01-01 00:00:00.000000003,"CASTILLO, RAMON S., PRES. AV. Y CALLE 12",AVENIDA,"CASTILLO, RAMON S., PRES. AV.","Paseo del Bajo, Recoleta, Buenos Aires, Comuna 2, Ciudad Autónoma de Buenos Aires, C1104AMT, Argentina",CALLE 12 (NO OFICIAL),"CASTILLO, RAMON S., PRES. AV. y CALLE 12 (NO OFICIAL)",2,-58.38526125,-34.5780581,AUTO-OBJETO FIJO,AUTO,OBJETO FIJO
2020-0041,1,2020-09-28,2020,9,28,,1970-01-01 00:00:00.000000001,"CURAPALIGUE Y PERON, EVA AV.",AVENIDA,CURAPALIGUE,"1001, Avenida Curapaligüe, Parque Chacabuco, Buenos Aires, Comuna 7, Ciudad Autónoma de Buenos Aires, C1406GZB, Argentina","PERON, EVA AV.","CURAPALIGUE y PERON, EVA AV.",7,-58.4475047,-34.63491705,MOTO-PASAJEROS,MOTO,PASAJEROS
2020-0042,1,2020-09-29,2020,9,29,,1970-01-01 00:00:00.000000017,"DIAZ, ANA Y SOLDADO DE LA FRONTERA AV.",AVENIDA,"DIAZ, ANA","Ana Díaz, Barrio Savio, Villa Lugano, Buenos Aires, Distrito del Deporte, Comuna 8, Ciudad Autónoma de Buenos Aires, C1439CRD, Argentina",SOLDADO DE LA FRONTERA AV.,"DIAZ, ANA y SOLDADO DE LA FRONTERA AV.",8,-58.46745752,-34.68192648,PEATON-PASAJEROS,PEATON,PASAJEROS
2020-0043,1,2020-09-30,2020,9,30,,1970-01-01 00:00:00.000000017,"ALEM, LEANDRO N. AV. Y PARAGUAY",AVENIDA,"ALEM, LEANDRO N. AV.","902, Avenida Leandro N. Alem, Retiro, Buenos Aires, Comuna 1, Ciudad Autónoma de Buenos Aires, C1001AAS, Argentina",PARAGUAY,"ALEM, LEANDRO N. AV. y PARAGUAY",1,-58.37202621,-34.59717942,PEATON-PASAJEROS,PEATON,PASAJEROS
2020-0044,1,2020-10-05,2020,10,5,,1970-01-01 00:00:00.000000000,LA PLATA AV. E INDEPENDENCIA,AVENIDA,LA PLATA AV.,"2, Avenida Juan Bautista Alberdi, Caballito, Buenos Aires, Comuna 6, Ciudad Autónoma de Buenos Aires, C1424BYN, Argentina",INDEPENDENCIA AV.,LA PLATA AV. e INDEPENDENCIA AV.,6,-58.42779702,-34.62207347,AUTO-AUTO,AUTO,AUTO
2020-0045,1,2020-10-19,2020,10,19,,1970-01-01 00:00:00.000000003,"PAZ, GRAL. AV. Y 27 DE FEBRERO AV.",GRAL PAZ,"PAZ, GRAL. AV.","Avenida General Paz, Barrio Sarmiento, Villa Celina, Partido de La Matanza, Buenos Aires, C1439FPF, Argentina",27 DE FEBRERO AV.,"PAZ, GRAL. AV. y 27 DE FEBRERO AV.",8,-58.46244952,-34.70524971,AUTO-CARGAS,AUTO,CARGAS
2020-0046,1,2020-10-27,2020,10,27,,1970-01-01 00:00:00.000000021,"NAZCA AV. Y CARRANZA, ADOLFO P.",AVENIDA,NAZCA AV.,"2902, Adolfo P. Carranza, Villa del Parque, Buenos Aires, Comuna 11, Ciudad Autónoma de Buenos Aires, C1417CUN, Argentina","CARRANZA, ADOLFO P.","NAZCA AV. y CARRANZA, ADOLFO P.",11,-58.4844016,-34.60776782,MOTO-MOTO,MOTO,MOTO
2020-0047,1,2020-10-27,2020,10,27,,1970-01-01 00:00:00.000000014,AUTOPISTA CAMPORA ALTURA LACARRA AV.,AUTOPISTA,AUTOPISTA PRESIDENTE HECTOR J. CAMPORA,"Teniente General Luís Dellepiane, Flores, Buenos Aires, Distrito del Deporte, Comuna 7, Ciudad Autónoma de Buenos Aires, C1407, Argentina",LACARRA AV.,AUTOPISTA PRESIDENTE HÃ‰CTOR J. CÃMPORA y LACARRA AV.,9,-58.46668375,-34.65174801,PEATON-CARGAS,PEATON,CARGAS
2020-0048,1,2020-10-29,2020,10,29,,1970-01-01 00:00:00.000000020,DORREGO AV. 614,AVENIDA,DORREGO AV.,614.0,"MG, Dorrego, Chacarita, Buenos Aires, Distrito Audiovisual, Comuna 15, Ciudad Autónoma de Buenos Aires, C1414ALN, Argentina",DORREGO AV. 614,15,-58.4495878,-34.59322448,MOTO-OBJETO FIJO,MOTO,OBJETO FIJO
2020-0049,1,2020-10-30,2020,10,30,,1970-01-01 00:00:00.000000020,"DEL LIBERTADOR AV. Y RAMOS MEJIA, JOSE MARIA, DR. AV.",AVENIDA,DEL LIBERTADOR AV.,"Avenida Maipú, Retiro, Buenos Aires, Comuna 1, Ciudad Autónoma de Buenos Aires, C1006AAD, Argentina","RAMOS MEJIA, JOSE MARIA, DR. AV.","DEL LIBERTADOR AV. y RAMOS MEJIA, JOSE MARIA, DR. AV.",1,-58.37533517,-34.59276462,PEATON-AUTO,PEATON,AUTO
2020-0050,1,2020-11-01,2020,11,1,,1970-01-01 00:00:00.000000022,SANTA FE AV. Y GODOY CRUZ,AVENIDA,SANTA FE AV.,"2702, Godoy Cruz, Palermo Pacífico, Palermo, Buenos Aires, Comuna 14, Ciudad Autónoma de Buenos Aires, C1425FQJ, Argentina",GODOY CRUZ,SANTA FE AV. y GODOY CRUZ,14,-58.42525456,-34.57866344,PEATON-MOTO,PEATON,MOTO
2020-0051,1,2020-11-05,2020,11,5,,1970-01-01 00:00:00.000000000,AVELLANEDA AV. Y MERCEDES,AVENIDA,AVELLANEDA AV.,"400, Mercedes, Floresta, Buenos Aires, Comuna 10, Ciudad Autónoma de Buenos Aires, C1407DYH, Argentina",MERCEDES,AVELLANEDA AV. y MERCEDES,10,-58.48493828,-34.62981124,MOTO-AUTO,MOTO,AUTO
2020-0052,1,2020-11-07,2020,11,7,,1970-01-01 00:00:00.000000006,TUCUMAN Y PUEYRREDON AV.,AVENIDA,TUCUMAN,"2700, Tucumán, Once, Balvanera, Buenos Aires, Comuna 3, Ciudad Autónoma de Buenos Aires, 1028, Argentina",PUEYRREDON AV.,TUCUMAN y PUEYRREDON AV.,3,-58.40480504,-34.60183884,BICICLETA-CARGAS,BICICLETA,CARGAS
2020-0053,1,2020-11-09,2020,11,9,,1970-01-01 00:00:00.000000003,"ALCORTA, AMANCIO AV. Y EINSTEIN, ALBERTO",AVENIDA,"ALCORTA, AMANCIO AV.","800, Alberto Einstein, Nueva Pompeya, Buenos Aires, Distrito Tecnológico, Comuna 4, Ciudad Autónoma de Buenos Aires, C1437, Argentina","EINSTEIN, ALBERTO","ALCORTA, AMANCIO AV. y EINSTEIN, ALBERTO",4,-58.41125934,-34.6541774,AUTO-AUTO,AUTO,AUTO
2020-0054,1,2020-11-19,2020,11,19,,1970-01-01 00:00:00.000000009,INCLAN Y ALBERTI,CALLE,INCLAN,"2502, Inclán, Parque Patricios, Buenos Aires, Comuna 4, Ciudad Autónoma de Buenos Aires, 1249, Argentina",ALBERTI,INCLAN y ALBERTI,4,-58.39956546,-34.6297708,BICICLETA-AUTO,BICICLETA,AUTO
2020-0055,1,2020-11-19,2020,11,19,,1970-01-01 00:00:00.000000012,OLAZABAL AV. 5437,AVENIDA,OLAZABAL AV.,5437.0,"Comisaría Vecinal 12-B, 5437, Avenida Olazábal, Villa Urquiza, Buenos Aires, Comuna 12, Ciudad Autónoma de Buenos Aires, C1431DOD, Argentina",OLAZABAL AV. 5437,12,-58.49005682,-34.5786897,PEATON-CARGAS,PEATON,CARGAS
2020-0056,1,2020-11-21,2020,11,21,,1970-01-01 00:00:00.000000013,"PAZ, GRAL. AV. Y DOCTOR RAMON CARRILLO",GRAL PAZ,"PAZ, GRAL. AV.","Avenida Coronel Roca, Villa Riachuelo, Buenos Aires, Distrito del Deporte, Comuna 8, Ciudad Autónoma de Buenos Aires, 1772, Argentina","ROCA, CNEL. AV.","PAZ, GRAL. AV. y ROCA, CNEL. AV.",8,-58.47064556,-34.69843756,MOTO-CARGAS,MOTO,CARGAS
2020-0057,1,2020-11-23,2020,11,23,,1970-01-01 00:00:00.000000007,"NAZCA AV. Y VIALE, LUIS",AVENIDA,NAZCA AV.,"2902, Luis Viale, Villa Santa Rita, Buenos Aires, Comuna 11, Ciudad Autónoma de Buenos Aires, C1416DLP, Argentina","VIALE, LUIS","NAZCA AV. y VIALE, LUIS",11,-58.4750156,-34.61945902,PEATON-AUTO,PEATON,AUTO
2020-0058,1,2020-11-24,2020,11,24,,1970-01-01 00:00:00.000000016,"OLIVERA AV. Y FALCON, RAMON L., CNEL.",AVENIDA,OLIVERA AV.,"4300, Coronel Ramón Lorenzo Falcón, Vélez Sarsfield, Buenos Aires, Comuna 10, Ciudad Autónoma de Buenos Aires, C1407DYW, Argentina","FALCON, RAMON L.,CNEL.","OLIVERA AV. y FALCON, RAMON L.,CNEL.",10,-58.48727942,-34.63652467,PEATON-AUTO,PEATON,AUTO
2020-0059,1,2020-12-01,2020,12,1,,1970-01-01 00:00:00.000000006,BRASIL 1100,CALLE,BRASIL,1100.0,"1, General Hornos, Constitución, Buenos Aires, Comuna 1, Ciudad Autónoma de Buenos Aires, C1138, Argentina",BRASIL 1100,1,-58.3795169,-34.62794241,PEATON-PASAJEROS,PEATON,PASAJEROS
2020-0060,1,2020-12-03,2020,12,3,,1970-01-01 00:00:00.000000020,"HOMERO Y PERON, EVA AV.",AVENIDA,HOMERO,"2001, Homero, Parque Avellaneda, Buenos Aires, Comuna 9, Ciudad Autónoma de Buenos Aires, C1439BSN, Argentina","PERON, EVA AV.","HOMERO y PERON, EVA AV.",9,-58.47750832,-34.65672199,PEATON-MOTO,PEATON,MOTO
2020-0061,1,2020-12-03,2020,12,3,,1970-01-01 00:00:00.000000014,"CANTILO, INT. Y UDAONDO, GUILLERMO AV.",AUTOPISTA,"CANTILO, INT.","Puente Ángel Labruna, Belgrano, Buenos Aires, Comuna 13, Ciudad Autónoma de Buenos Aires, C1424BCL, Argentina","UDAONDO, GUILLERMO AV.","CANTILO, INT. y UDAONDO, GUILLERMO AV.",13,-58.44927253,-34.54048625,MOTO-CARGAS,MOTO,CARGAS
2020-0062,1,2020-12-04,2020,12,4,,1970-01-01 00:00:00.000000017,MORENO 1845,CALLE,MORENO,1845.0,"1843, Moreno, Balvanera, Buenos Aires, Comuna 3, Ciudad Autónoma de Buenos Aires, C1079ABD, Argentina",MORENO 1845,3,-58.39246272,-34.61253541,BICICLETA-PASAJEROS,BICICLETA,PASAJEROS
2020-0063,2,2020-12-05,2020,12,5,,1970-01-01 00:00:00.000000007,NUEVA YORK Y ALTA GRACIA,CALLE,NUEVA YORK,"5297, Nueva York, Villa Devoto, Buenos Aires, Comuna 11, Ciudad Autónoma de Buenos Aires, B1674AOA, Argentina",ALTA GRACIA,NUEVA YORK y ALTA GRACIA,11,-58.52783814,-34.61047001,PEATON_MOTO-MOTO,PEATON_MOTO,MOTO
2020-0065,1,2020-12-05,2020,12,5,,1970-01-01 00:00:00.000000016,"PAZ, GRAL. AV. Y GOYENECHE, ROBERTO PARQUE AV.",GRAL PAZ,"PAZ, GRAL. AV.","Avenida General Paz, Saavedra, Buenos Aires, Comuna 12, Ciudad Autónoma de Buenos Aires, C1430DAK, Argentina","GOYENECHE, ROBERTO PARQUE AV.","PAZ, GRAL. AV. y GOYENECHE, ROBERTO PARQUE AV.",12,-58.49332664,-34.54836855,MOTO-AUTO,MOTO,AUTO
2020-0066,1,2020-12-07,2020,12,7,,1970-01-01 00:00:00.000000004,AUTOPISTA PERITO MORENO ALTURA ESTACION DE TREN VILLA LURO,AUTOPISTA,AUTOPISTA PERITO MORENO,"Autopista Perito Moreno, Villa Luro, Buenos Aires, Comuna 10, Ciudad Autónoma de Buenos Aires, C1407DZF, Argentina","Autopista Perito Moreno, Villa Luro, Buenos Aires, Comuna 10, Ciudad Autónoma de Buenos Aires, C1407DZF, Argentina",AUTOPISTA PERITO MORENO (ALTURA ESTACION DE TREN VILLA LURO),10,-58.50178784,-34.63593897,MOTO-OBJETO FIJO,MOTO,OBJETO FIJO
2020-0067,1,2020-12-11,2020,12,11,,1970-01-01 00:00:00.000000022,SAENZ AV. Y BEAZLEY,AVENIDA,SAENZ AV.,"1301, Avenida Intendente Francisco Rabanal, Nueva Pompeya, Buenos Aires, Comuna 4, Ciudad Autónoma de Buenos Aires, C1437, Argentina",BEAZLEY,SAENZ AV. y BEAZLEY,4,-58.41657793,-34.65476216,PEATON-PASAJEROS,PEATON,PASAJEROS
2020-0068,1,2020-12-12,2020,12,12,,1970-01-01 00:00:00.000000020,DEL LIBERTADOR AV. Y AUSTRIA,AVENIDA,DEL LIBERTADOR AV.,"1701, Avenida Del Libertador, La Isla, Recoleta, Buenos Aires, Comuna 2, Ciudad Autónoma de Buenos Aires, C1425AAR, Argentina",AUSTRIA,DEL LIBERTADOR AV. y AUSTRIA,2,-58.39731474,-34.58307887,MOTO-AUTO,MOTO,AUTO
2020-0069,1,2020-12-15,2020,12,15,,1970-01-01 00:00:00.000000005,"INDEPENDENCIA AV. Y SAENZ PEÑA, LUIS, PRES.",AVENIDA,INDEPENDENCIA AV.,"800, Presidente Luis Sáenz Peña, Monserrat, Buenos Aires, Comuna 1, Ciudad Autónoma de Buenos Aires, 1110, Argentina","SAENZ PE?A, LUIS, PRES.","INDEPENDENCIA AV. y SAENZ PEÃ‘A, LUIS, PRES.",1,-58.38746381,-34.61790839,MOTO-PASAJEROS,MOTO,PASAJEROS
2020-0070,1,2020-12-17,2020,12,17,,1970-01-01 00:00:00.000000015,"CALLAO AV. Y LAS HERAS, GENERAL",AVENIDA,CALLAO AV.,"1499, Avenida Callao, Recoleta, Buenos Aires, Comuna 2, Ciudad Autónoma de Buenos Aires, C1012AAZ, Argentina","LAS HERAS, GENERAL","CALLAO AV. y LAS HERAS, GENERAL",2,-58.39189441,-34.59176378,PEATON-PASAJEROS,PEATON,PASAJEROS
